{
  "crs": "EPSG:5514",
  "parcel": {
    "coordinates": [
      [0, 0],
      [25, 0],
      [25, 35],
      [20, 40],
      [0, 40],
      [0, 0]
    ]
  },
  "house": {
    "coordinates": [
      [0, 0],
      [12, 0],
      [12, 10],
      [0, 10],
      [0, 0]
    ]
  },
  "rotation": {
    "min": 0,
    "max": 360,
    "step": 15
  },
  "grid_step": 1.0,
  "seed": 42
}
